{
  "task_id": "GT13_CROSS_INTERNAL_DEV_STAFF_DATA",
  "use_skills": true,
  "selected_departments": [
    "hr-agent",
    "technology-agent"
  ],
  "skill_sequence": [
    "hr-employee-database",
    "technology-feasibility-assessment",
    "technology-specification-confirmation",
    "technology-solution-design",
    "technology-task-breakdown"
  ],
  "final_status": "completed",
  "blocked_by": [],
  "route_choice": {
    "staff_data": "hr-employee-database",
    "feasibility": "technology-feasibility-assessment",
    "specification": "technology-specification-confirmation",
    "design": "technology-solution-design",
    "assignment": "technology-task-breakdown"
  },
  "reason": "先查询现有员工技能与项目经验以支撑人员可行性判断，再完成规格确认和方案设计，最终结合员工能力拆解并分配可执行技术任务；按要求不进入开发实施。"
}
