{
  "task_id": "GT15_CROSS_SUPPLIER_CONTRACT_PO",
  "use_skills": true,
  "selected_departments": [
    "business-agent",
    "procurement-agent"
  ],
  "skill_sequence": [
    "business-negotiation",
    "procurement-contract-generation",
    "procurement-purchase-order"
  ],
  "final_status": "completed",
  "blocked_by": [],
  "route_choice": {
    "start_state": "预算已确定且供应商已选定",
    "target_state": "采购订单具备正式下单条件",
    "excluded_scope": "交付跟踪及后续流程"
  },
  "reason": "预算与选商已完成，后续应依次确认商务条款、生成并审批采购合同，再据已批准合同生成和释放采购订单；本次不进入交付流程。"
}
