{
  "task_id": "GT07_CROSS_CUSTOM_TECH_SUPPLIER",
  "use_skills": true,
  "selected_departments": [
    "business-agent",
    "technology-agent",
    "finance-agent",
    "procurement-agent"
  ],
  "skill_sequence": [
    "business-customer-lead",
    "business-requirement-communication",
    "business-opportunity-assessment",
    "technology-requirement",
    "technology-feasibility-assessment",
    "technology-specification-confirmation",
    "technology-solution-design",
    "business-solution-quotation",
    "procurement-requirement",
    "finance-budget-planning",
    "finance-budget-check",
    "procurement-supplier-search",
    "procurement-supplier-qualification",
    "procurement-rfq-generation",
    "procurement-quote-comparison",
    "procurement-supplier-scoring",
    "procurement-supplier-selection"
  ],
  "final_status": "completed",
  "blocked_by": [],
  "route_choice": {
    "business_route": "lead_to_qualified_solution",
    "technology_route": "requirement_to_confirmed_design",
    "procurement_route": "budget_cleared_supplier_selection",
    "stop_boundary": "supplier_selection_before_contract_and_po"
  },
  "reason": "从客户线索依次确认需求、商机、技术可行性与规格，完成预算准备和供应商搜索、准入、询价、比价、评分及选商，并在客户合同、供应合同和采购订单之前停止。"
}
