{
  "task_id": "GT03_PROC_GOAL",
  "use_skills": true,
  "selected_departments": [
    "procurement-agent"
  ],
  "skill_sequence": [
    "procurement-supplier-search",
    "procurement-supplier-qualification",
    "procurement-rfq-generation",
    "procurement-quote-comparison",
    "procurement-supplier-scoring",
    "procurement-supplier-selection"
  ],
  "final_status": "completed",
  "blocked_by": [],
  "route_choice": {
    "route": "supplier_discovery_to_selection",
    "scope": "pre_award_only"
  },
  "reason": "采购需求和预算已确认，应从供应商搜索开始，依次完成资质准入、询价、比价、综合评分和最终选商；不包含谈判、合同或采购订单。"
}
