{
  "task_id": "GT12_CROSS_BUSINESS_TO_PO",
  "use_skills": true,
  "selected_departments": [
    "business-agent",
    "procurement-agent",
    "finance-agent"
  ],
  "skill_sequence": [
    "business-requirement-communication",
    "business-opportunity-assessment",
    "procurement-requirement",
    "finance-budget-check",
    "procurement-supplier-search",
    "procurement-supplier-qualification",
    "procurement-rfq-generation",
    "procurement-quote-comparison",
    "procurement-supplier-scoring",
    "procurement-supplier-selection",
    "business-negotiation",
    "procurement-contract-generation",
    "procurement-purchase-order"
  ],
  "final_status": "completed",
  "blocked_by": [],
  "route_choice": {
    "需求与商机": "business-agent",
    "预算核查": "finance-agent",
    "寻源至下单": "procurement-agent",
    "供应商谈判": "business-agent"
  },
  "reason": "线索已建档，无需重复创建；应先确认客户需求并评估商机，商机可行后形成采购需求、核查预算，再依次完成供应商寻源、准入、询价比价、评分选商、谈判、供应合同和采购订单。"
}
