{
  "task_id": "GT04_TECH_GOAL",
  "use_skills": true,
  "selected_departments": [
    "technology-agent"
  ],
  "skill_sequence": [
    "technology-feasibility-assessment",
    "technology-specification-confirmation",
    "technology-solution-design",
    "technology-task-breakdown"
  ],
  "final_status": "completed",
  "blocked_by": [],
  "route_choice": {
    "feasibility": "technology-feasibility-assessment",
    "specification": "technology-specification-confirmation",
    "design": "technology-solution-design",
    "planning": "technology-task-breakdown"
  },
  "reason": "技术需求已整理完成，应依次完成可行性评估、规格确认、方案设计和任务拆解，形成可进入开发阶段的实施方案；本次不调用开发实施 Skill。"
}
