{
  "task_id": "GT18_SPECIAL_BUILD_OR_BUY",
  "use_skills": true,
  "selected_departments": [
    "technology-agent"
  ],
  "skill_sequence": [
    "technology-specification-confirmation",
    "technology-solution-design",
    "technology-task-breakdown",
    "technology-development-implementation",
    "technology-test-acceptance"
  ],
  "final_status": "completed",
  "blocked_by": [],
  "route_choice": {
    "build_or_buy": "internal_build",
    "terminal_gate": "technology_test_acceptance"
  },
  "reason": "技术需求已确定由内部团队建设，因此排除采购路线，按规格确认、方案设计、任务拆解、开发实施和技术测试验收推进。"
}
