{
  "task_id": "GT09_CROSS_BUS_SERVICE_PAYMENT",
  "use_skills": true,
  "selected_departments": [
    "business-agent",
    "finance-agent"
  ],
  "skill_sequence": [
    "business-acceptance",
    "finance-invoice-verification",
    "finance-payment-approval",
    "finance-accounting"
  ],
  "final_status": "blocked",
  "blocked_by": [
    "business-acceptance"
  ],
  "route_choice": {
    "acceptance_route": "business-acceptance"
  },
  "reason": "采用业务验收路线；需先由业务团队确认咨询成果符合约定，之后才能核验发票、审批付款并入账。"
}
