{
  "task_id": "GT03_PROC_GOAL",
  "use_skills": true,
  "selected_departments": [
    "procurement-agent"
  ],
  "skill_sequence": [
    "procurement-supplier-search",
    "procurement-supplier-qualification",
    "procurement-rfq-generation",
    "procurement-quote-comparison",
    "procurement-supplier-scoring",
    "procurement-supplier-selection"
  ],
  "final_status": "completed",
  "blocked_by": [],
  "route_choice": {
    "供应商发现": "procurement-supplier-search",
    "资质准入": "procurement-supplier-qualification",
    "询价准备": "procurement-rfq-generation",
    "报价比较": "procurement-quote-comparison",
    "综合评分": "procurement-supplier-scoring",
    "最终选商": "procurement-supplier-selection"
  },
  "reason": "采购需求和预算已确认，可从供应商搜索开始，依次完成资质检查、询价、报价比较、综合评分和选商；无需需求识别、预算检查、谈判、合同或采购订单相关 Skill。"
}
