{
  "task_id": "GT08_CROSS_TECH_DELIVERY_PAYMENT",
  "use_skills": true,
  "selected_departments": [
    "procurement-agent",
    "technology-agent",
    "finance-agent"
  ],
  "skill_sequence": [
    "procurement-delivery-tracking",
    "technology-test-acceptance",
    "procurement-delivery-acceptance",
    "finance-invoice-verification",
    "finance-payment-approval",
    "finance-accounting"
  ],
  "final_status": "blocked",
  "blocked_by": [
    "technology-test-acceptance"
  ],
  "route_choice": {
    "delivery_tracking": "procurement-delivery-tracking",
    "technical_acceptance": "technology-test-acceptance",
    "goods_acceptance": "procurement-delivery-acceptance",
    "invoice_check": "finance-invoice-verification",
    "payment_control": "finance-payment-approval",
    "posting": "finance-accounting"
  },
  "reason": "设备虽已送达且发票已提交，但技术验收尚未完成；需先完成技术与采购交付验收，随后才能核验发票、审批付款并入账。"
}
