{
  "task_id": "GT14_CROSS_PAYMENT_PERFORMANCE",
  "use_skills": true,
  "selected_departments": [
    "finance-agent",
    "procurement-agent"
  ],
  "skill_sequence": [
    "finance-invoice-verification",
    "finance-payment-approval",
    "finance-accounting",
    "procurement-supplier-evaluation"
  ],
  "final_status": "completed",
  "blocked_by": [],
  "route_choice": {
    "payment_accounting": "finance-invoice-verification->finance-payment-approval->finance-accounting",
    "supplier_performance": "finance-payment-approval->procurement-supplier-evaluation"
  },
  "reason": "交付验收已完成，应先核验发票，再形成付款审批并入账；付款审批后将本次履约证据纳入供应商绩效评价。"
}
