{
  "task_id": "GT03_PROC_GOAL",
  "use_skills": true,
  "selected_departments": [
    "procurement-agent"
  ],
  "skill_sequence": [
    "procurement-supplier-search",
    "procurement-supplier-qualification",
    "procurement-rfq-generation",
    "procurement-quote-comparison",
    "procurement-supplier-scoring",
    "procurement-supplier-selection"
  ],
  "final_status": "completed",
  "blocked_by": [],
  "route_choice": {
    "start": "procurement-supplier-search",
    "end": "procurement-supplier-selection",
    "boundary": "exclude_negotiation_contract_and_order"
  },
  "reason": "采购内容和预算已确定但尚无候选方，应依次完成供应商搜索、资质检查、询价、报价比较、综合评分和选商；谈判、签约及下单均不纳入路线。"
}
